{
  "qaReportId": "01J9QR2B3C4D5E6F7G8H9K0P3H",
  "envelope": {
    "schemaVersion": "1.0.0",
    "createdAt": "2026-07-29T06:10:00Z",
    "createdBy": {
      "kind": "skill",
      "skill": "render",
      "skillVersion": "1.0.0"
    }
  },
  "jobId": "test-mixed",
  "renderId": "01J9RD2B3C4D5E6F7G8H9K0N2B",
  "renderManifestId": "01J9RM2B3C4D5E6F7G8H9K0N1A",
  "tier": "draft",
  "rulesetVersion": "1.0.0",
  "gateStatus": "pass_with_waivers",
  "checksRun": [
    {
      "checkId": "missing_media",
      "status": "ran",
      "reason": null
    },
    {
      "checkId": "container_corruption",
      "status": "ran",
      "reason": null
    },
    {
      "checkId": "source_range_validity",
      "status": "ran",
      "reason": null
    },
    {
      "checkId": "output_dimensions",
      "status": "ran",
      "reason": null
    },
    {
      "checkId": "output_duration",
      "status": "ran",
      "reason": null
    },
    {
      "checkId": "codec_profile",
      "status": "ran",
      "reason": null
    },
    {
      "checkId": "black_frames",
      "status": "ran",
      "reason": null
    },
    {
      "checkId": "frozen_frames",
      "status": "ran",
      "reason": null
    },
    {
      "checkId": "duplicate_frames",
      "status": "ran",
      "reason": null
    },
    {
      "checkId": "crop_failure",
      "status": "ran",
      "reason": null
    },
    {
      "checkId": "unexpected_silence",
      "status": "ran",
      "reason": null
    },
    {
      "checkId": "audio_clipping",
      "status": "ran",
      "reason": null
    },
    {
      "checkId": "loudness_target",
      "status": "ran",
      "reason": null
    },
    {
      "checkId": "true_peak",
      "status": "ran",
      "reason": null
    },
    {
      "checkId": "av_sync_drift",
      "status": "ran",
      "reason": null
    },
    {
      "checkId": "caption_file_present",
      "status": "ran",
      "reason": null
    },
    {
      "checkId": "caption_overflow",
      "status": "ran",
      "reason": null
    },
    {
      "checkId": "caption_readability",
      "status": "ran",
      "reason": null
    },
    {
      "checkId": "caption_timing",
      "status": "ran",
      "reason": null
    },
    {
      "checkId": "caption_safe_zone",
      "status": "ran",
      "reason": null
    },
    {
      "checkId": "caption_spelling",
      "status": "skipped",
      "reason": "No en-AU dictionary is vendored at Phase 0; spelling is surfaced through caption_name_flag review instead of silently reporting clean."
    },
    {
      "checkId": "caption_name_flag",
      "status": "ran",
      "reason": null
    },
    {
      "checkId": "non_speech_cue_review",
      "status": "ran",
      "reason": null
    }
  ],
  "findings": [
    {
      "findingId": "caption_safe_zone:cue-3:23040-30720",
      "checkId": "caption_safe_zone",
      "severity": "warning",
      "waivable": true,
      "object": "cue-3",
      "message": "Caption cue 3 extends 4 px into the TikTok right-edge safe zone (overlay 2026-07: right margin 0.06 of width = 43 px; cue right edge at 681 px of 720).",
      "fix": "Shorten the display text, or reduce the caption box width to 0.86 of the canvas in the style profile.",
      "timeRange": {
        "startTicks": 23040,
        "endTicks": 30720,
        "timebase": {
          "num": 1,
          "den": 15360
        }
      }
    },
    {
      "findingId": "non_speech_cue_review:audio:46080-52224",
      "checkId": "non_speech_cue_review",
      "severity": "info",
      "waivable": true,
      "object": "audio",
      "message": "A meaningful non-speech audio event (door_slam) from the source index falls inside the output and has no caption cue.",
      "fix": "Add a bracketed non-speech cue such as [door slams] if it carries meaning, or ignore if it is ambience.",
      "timeRange": {
        "startTicks": 46080,
        "endTicks": 52224,
        "timebase": {
          "num": 1,
          "den": 15360
        }
      }
    }
  ],
  "waiverIds": [
    "01J9QW2B3C4D5E6F7G8H9K0P1F"
  ],
  "waivedFindingIds": [
    "caption_safe_zone:cue-3:23040-30720"
  ],
  "planHash": {
    "algorithm": "sha256",
    "value": "cccccccccccccccccccccccccccccccccccccccccccccccccccccccccccccccc"
  }
}
